<?xml version="1.0" encoding="windows-1251"?>
<table xmlns="www.sqlpatchbuilder.org/table"
       xmlns:xsi="http://www.w3.org/2001/XMLSchema-instance"
       xsi:schemaLocation="www.sqlpatchbuilder.org/table ../../xsd/table-definition.xsd">
    <name>OPERATION</name>
    <comments>Таблица для регистрации операции GL - первичной информации для последующего формирования проводок GL</comments>
    <columns>
        <column>
            <name>AC_POS_DR</name>
            <type>VARCHAR2(20 CHAR)</type>
            <comments>Счет валютной позиции для дебетовой стороны операции</comments>
        </column>
        <column>
            <name>AC_POS_EQV_DR</name>
            <type>VARCHAR2(20 CHAR)</type>
            <comments>Счет эквивалента валютной позиции для дебетовой стороны операции</comments>
        </column>
        <column>
            <name>AC_POS_CR</name>
            <type>VARCHAR2(20 CHAR)</type>
            <comments>Счет валютной позиции для кредитовой стороны операции</comments>
        </column>
        <column>
            <name>AC_POS_EQV_CR</name>
            <type>VARCHAR2(20 CHAR)</type>
            <comments>Счет эквивалента валютной позиции для кредитовой стороны операции</comments>
        </column>
        <column>
            <name>FCYBC_EQV_AMNT</name>
            <type>NUMBER(19,3)</type>
            <comments>Локальный эквивалент суммы базовой валют по курсу ЦБ на дату операции</comments>
        </column>
        <column>
            <name>EXCН_DIFF</name>
            <type>NUMBER(19,3)</type>
            <comments><![CDATA[Курсовая разница от валютообменной операции, >0 для положительной, <0 для отрицательной]]></comments>
        </column>
        <column>
            <name>BRANCH_DR</name>
            <type>CHAR(3 CHAR)</type>
<!--        TODO в ФСД обязательное поле    <mandatory>true</mandatory>-->
            <comments>Бранч  FC, в котором открыт счет дебета AC_DR</comments>
        </column>
        <column>
            <name>BRANCH_CR</name>
            <type>CHAR(3 CHAR)</type>
<!--         TODO в ФСД обязательное поле   <mandatory>true</mandatory>-->
            <comments>Бранч  FC, в котором открыт счет дебета AC_DR</comments>
        </column>
        <column>
            <name>BANK_ID_DR</name>
            <type>CHAR(5 CHAR)</type>
<!--            TODO в ФСД обязательное поле <mandatory>true</mandatory>-->
            <comments>МФО Банка, в котором открыт счет дебета AC_DR</comments>
        </column>
        <column>
            <name>BANK_ID_CR</name>
            <type>CHAR(5 CHAR)</type>
<!--          TODO в ФСД обязательное поле   <mandatory>true</mandatory>-->
            <comments>МФО Банка, в котором открыт счет кредита AC_DR</comments>
        </column>
    </columns>
</table>